{
  "applicationLifecycle": "fresh-solver",
  "backendRole": "regular-bv",
  "compatibleSolverVersions": [
    "1.3.4"
  ],
  "constraints": [],
  "inventoryId": "cvc5-1.3.4-runtime-v0",
  "options": {
    "abstract-values": {
      "default": false,
      "kind": "boolean"
    },
    "arrays-eager-index": {
      "default": true,
      "kind": "boolean"
    },
    "arrays-eager-lemmas": {
      "default": false,
      "kind": "boolean"
    },
    "arrays-optimize-linear": {
      "default": true,
      "kind": "boolean"
    },
    "arrays-prop": {
      "default": 2,
      "kind": "integer",
      "maximum": 2,
      "minimum": 0,
      "sampling": "uniform",
      "step": 1
    },
    "arrays-reduce-sharing": {
      "default": false,
      "kind": "boolean"
    },
    "assign-function-values": {
      "default": true,
      "kind": "boolean"
    },
    "bitwise-eq": {
      "default": false,
      "kind": "boolean"
    },
    "bv-assert-input": {
      "default": false,
      "kind": "boolean"
    },
    "bv-eager-eval": {
      "default": false,
      "kind": "boolean"
    },
    "bv-eq-engine": {
      "default": true,
      "kind": "boolean"
    },
    "bv-gauss-elim": {
      "default": false,
      "kind": "boolean"
    },
    "bv-intro-pow2": {
      "default": false,
      "kind": "boolean"
    },
    "bv-propagate": {
      "default": true,
      "kind": "boolean"
    },
    "bv-solver": {
      "default": "bitblast",
      "kind": "categorical",
      "values": [
        "bitblast",
        "bitblast-internal"
      ]
    },
    "bv-to-bool": {
      "default": false,
      "kind": "boolean"
    },
    "bv-to-int-use-pow2": {
      "activeWhen": {
        "not": {
          "equals": "off",
          "option": "solve-bv-as-int"
        }
      },
      "default": false,
      "kind": "boolean"
    },
    "bvand-integer-granularity": {
      "activeWhen": {
        "not": {
          "equals": "off",
          "option": "solve-bv-as-int"
        }
      },
      "default": 1,
      "kind": "integer",
      "maximum": 8,
      "minimum": 1,
      "sampling": "uniform",
      "step": 1
    },
    "conflict-process": {
      "default": "none",
      "kind": "categorical",
      "values": [
        "min",
        "min-ext",
        "none"
      ]
    },
    "eager-arith-bv-conv": {
      "default": false,
      "kind": "boolean"
    },
    "early-ite-removal": {
      "default": false,
      "kind": "boolean"
    },
    "ee-mode": {
      "default": "distributed",
      "kind": "categorical",
      "values": [
        "central",
        "distributed"
      ]
    },
    "ext-rew-prep": {
      "default": "off",
      "kind": "categorical",
      "values": [
        "agg",
        "off",
        "use"
      ]
    },
    "foreign-theory-rewrite": {
      "default": false,
      "kind": "boolean"
    },
    "iand-mode": {
      "activeWhen": {
        "not": {
          "equals": "off",
          "option": "solve-bv-as-int"
        }
      },
      "default": "value",
      "kind": "categorical",
      "values": [
        "bitwise",
        "sum",
        "value"
      ]
    },
    "jh-rlv-order": {
      "default": false,
      "kind": "boolean"
    },
    "jh-skolem": {
      "default": "first",
      "kind": "categorical",
      "values": [
        "first",
        "last"
      ]
    },
    "jh-skolem-rlv": {
      "default": "assert",
      "kind": "categorical",
      "values": [
        "always",
        "assert"
      ]
    },
    "lemma-inprocess-infer-eq-lit": {
      "default": false,
      "kind": "boolean"
    },
    "lemma-inprocess-subs": {
      "default": "simple",
      "kind": "categorical",
      "values": [
        "all",
        "simple"
      ]
    },
    "minisat-simplification": {
      "activeWhen": {
        "equals": "minisat",
        "option": "sat-solver"
      },
      "default": "all",
      "kind": "categorical",
      "values": [
        "all",
        "clause-elim",
        "none"
      ]
    },
    "model-based-arith-bv-conv": {
      "default": false,
      "kind": "boolean"
    },
    "model-cores": {
      "default": "none",
      "kind": "categorical",
      "values": [
        "non-implied",
        "none",
        "simple"
      ]
    },
    "model-var-elim-uneval": {
      "default": true,
      "kind": "boolean"
    },
    "on-repeat-ite-simp": {
      "default": false,
      "kind": "boolean"
    },
    "preregister-mode": {
      "default": "eager",
      "kind": "categorical",
      "values": [
        "eager",
        "lazy"
      ]
    },
    "random-freq": {
      "activeWhen": {
        "equals": "minisat",
        "option": "sat-solver"
      },
      "default": 0.0,
      "kind": "number",
      "maximum": 1.0,
      "minimum": 0.0,
      "sampling": "uniform"
    },
    "relevance-filter": {
      "default": false,
      "kind": "boolean"
    },
    "repeat-simp": {
      "default": false,
      "kind": "boolean"
    },
    "restart-int-base": {
      "activeWhen": {
        "equals": "minisat",
        "option": "sat-solver"
      },
      "default": 25,
      "kind": "integer",
      "maximum": 10000,
      "minimum": 1,
      "sampling": "log-uniform",
      "step": 1
    },
    "restart-int-inc": {
      "activeWhen": {
        "equals": "minisat",
        "option": "sat-solver"
      },
      "default": 3.0,
      "kind": "number",
      "maximum": 1000.0,
      "minimum": 0.0,
      "positiveMinimum": 0.01,
      "sampling": "log-uniform-or-zero"
    },
    "sat-solver": {
      "default": "minisat",
      "kind": "categorical",
      "values": [
        "cadical",
        "minisat"
      ]
    },
    "simp-ite-compress": {
      "default": false,
      "kind": "boolean"
    },
    "simp-with-care": {
      "default": false,
      "kind": "boolean"
    },
    "simplification": {
      "default": "batch",
      "kind": "categorical",
      "values": [
        "batch",
        "none"
      ]
    },
    "simplification-bcp": {
      "default": false,
      "kind": "boolean"
    },
    "solve-bv-as-int": {
      "default": "off",
      "kind": "categorical",
      "values": [
        "bitwise",
        "bv",
        "iand",
        "off",
        "sum"
      ]
    },
    "sort-inference": {
      "default": false,
      "kind": "boolean"
    },
    "static-learning": {
      "default": true,
      "kind": "boolean"
    },
    "symmetry-breaker": {
      "default": true,
      "kind": "boolean"
    },
    "theoryof-mode": {
      "default": "type",
      "kind": "categorical",
      "values": [
        "term",
        "type"
      ]
    },
    "uf-card-exp": {
      "default": true,
      "kind": "boolean"
    },
    "uf-lazy-ll": {
      "default": true,
      "kind": "boolean"
    },
    "uf-ss": {
      "default": "full",
      "kind": "categorical",
      "values": [
        "full",
        "no-minimal",
        "none"
      ]
    },
    "uf-ss-abort-card": {
      "activeWhen": {
        "not": {
          "equals": "none",
          "option": "uf-ss"
        }
      },
      "default": -1,
      "kind": "integer",
      "maximum": 64,
      "minimum": -1,
      "sampling": "uniform",
      "step": 1
    },
    "uf-ss-fair": {
      "activeWhen": {
        "not": {
          "equals": "none",
          "option": "uf-ss"
        }
      },
      "default": true,
      "kind": "boolean"
    },
    "uf-ss-fair-monotone": {
      "activeWhen": {
        "not": {
          "equals": "none",
          "option": "uf-ss"
        }
      },
      "default": false,
      "kind": "boolean"
    }
  },
  "parameterSpaceId": "cvc5-1.3.4-regular-bv-wide-v0",
  "schemaVersion": "cvc5-parameter-space-v0",
  "targetSolver": "cvc5"
}
